<!ELEMENT company (name, employees)>
<!ELEMENT name (#PCDATA)>
<!ELEMENT employees (employee+)>
<!ELEMENT employee (id, name, department)>
<!ELEMENT id (#PCDATA)>
<!ELEMENT name (#PCDATA)>
<!ELEMENT department (#PCDATA)>